{
  "schema_version": "0.1",
  "sim_version": "0.2.0",
  "run_id": "r-3h6wx9adsnlft",
  "created_at": "2026-10-12T16:02:42.510201Z",
  "domain": {
    "id": "aquaculture-pond",
    "version": "0.1.0",
    "digest": "sha256:4e779d9f920434371f3358287e981d7716222585dd2ec8fdddd7149bca3cbe07"
  },
  "domain_spec": {
    "id": "aquaculture-pond",
    "version": "0.1.0",
    "title": "Aquaculture pond water quality",
    "description": "Eight shrimp ponds. Dissolved oxygen falls through the night as respiration outpaces photosynthesis and recovers after sunrise. Below roughly 2 mg/L the stock begins to die within about an hour. The closed-loop showcase domain: detect, reason, propose, authorize, actuate, and observe recovery, all inside a physical deadline.",
    "axes": {
      "rate": "medium",
      "cardinality": "small",
      "value_shape": [
        "scalar",
        "enum"
      ],
      "cadence": [
        "periodic"
      ],
      "lateness": "bounded",
      "absence": "signal",
      "time_reference": "wall",
      "correlation": [
        "coupled"
      ],
      "seasonality": [
        "diurnal"
      ],
      "actuation": "fast_physical",
      "consequence": [
        "safety",
        "cost"
      ],
      "fidelity": [
        "F1"
      ]
    },
    "stresses": "A fast nonlinear failure with a hard deadline: every other domain tolerates a slow agent, and this one measures it in dead stock. The whole chain — admit, band, trigger, reason, validate, authorize, dispatch, actuate — must complete inside a physical window the world does not extend.",
    "entities": {
      "id_template": "site-a/pond-{n}",
      "entity_type": "pond",
      "count": {
        "default": 8,
        "min": 1,
        "max": 64
      }
    },
    "state": [
      {
        "name": "dissolved_oxygen_true",
        "unit": "mg/L",
        "initial": 6.5,
        "min": 0.0,
        "max": 14.0,
        "description": "The actual dissolved oxygen in the pond. Never observable directly; the probe channel observes it through noise, drift, and possible fouling."
      },
      {
        "name": "do_forcing",
        "unit": "mg/L",
        "initial": 5.6,
        "min": 0.0,
        "max": 12.0,
        "description": "The solar diurnal cycle: the equilibrium oxygen level the pond tracks before aeration, feeding and bloom state. Minimum around 05:00, which is what produces the pre-dawn crash this domain exists for."
      },
      {
        "name": "water_temp_true",
        "unit": "degC",
        "initial": 28.0,
        "min": 15.0,
        "max": 40.0
      },
      {
        "name": "ammonia_true",
        "unit": "mg/L",
        "initial": 0.2,
        "min": 0.0,
        "max": 8.0
      },
      {
        "name": "ph_true",
        "unit": "pH",
        "initial": 7.9,
        "min": 5.0,
        "max": 10.0,
        "description": "No free dynamics: piecewise constant, moved by faults and effectors only."
      },
      {
        "name": "algae_biomass",
        "unit": "rel",
        "initial": 1.0,
        "min": 0.0,
        "max": 5.0,
        "description": "Drives the oxygen balance: a bloom raises it, a crash converts the oxygen source into an oxygen sink."
      },
      {
        "name": "aerator_output",
        "unit": "rel",
        "initial": 0.0,
        "min": 0.0,
        "max": 1.0,
        "description": "No free dynamics: changed only by effector effects (90 s dead time, 20-minute lag, declared on start_aerator) and by faults. Modelling the spin-up here as well would apply the dead time twice."
      },
      {
        "name": "probe_fouling",
        "unit": "rel",
        "initial": 0.0,
        "min": 0.0,
        "max": 1.0,
        "description": "A fouled membrane reads high and stable while the pond suffocates. Acts on the dissolved_oxygen channel through its observation_bias — the lethal sensor fault, and the reason a threshold on the probe channel alone is not a safe design."
      },
      {
        "name": "feed_load",
        "unit": "rel",
        "initial": 1.0,
        "min": 0.0,
        "max": 3.0,
        "description": "No free dynamics: a baseline of 1.0, moved by the overfeeding fault and the halt_feeding effector."
      },
      {
        "name": "stock_mortality",
        "unit": "frac",
        "initial": 0.0,
        "min": 0.0,
        "max": 1.0,
        "description": "The counterfactual outcome variable. Accumulates while dissolved_oxygen_true is below the lethal threshold. Director-only; never observed by any channel."
      }
    ],
    "dynamics": [
      {
        "target": "do_forcing",
        "tier": "F0",
        "f0": {
          "baseline": 5.6,
          "seasonality": [
            {
              "period_s": 86400,
              "amplitude": 3.0,
              "phase_rad": -2.88
            }
          ],
          "drift_per_hour": 0.0
        }
      },
      {
        "target": "dissolved_oxygen_true",
        "tier": "F1",
        "dt_ms": 1000,
        "f1": {
          "form": "first_order_lag",
          "time_constant_s": 3600,
          "gain": 1.0,
          "inputs": [
            {
              "state": "do_forcing",
              "coef": 1.0
            },
            {
              "state": "algae_biomass",
              "coef": 1.5
            },
            {
              "state": "aerator_output",
              "coef": 2.2
            },
            {
              "state": "feed_load",
              "coef": -0.6
            }
          ],
          "clamp": {
            "min": 0.0,
            "max": 14.0
          }
        }
      },
      {
        "target": "water_temp_true",
        "tier": "F0",
        "f0": {
          "baseline": 28.0,
          "seasonality": [
            {
              "period_s": 86400,
              "amplitude": 2.2,
              "phase_rad": -1.6
            }
          ],
          "drift_per_hour": 0.0
        }
      },
      {
        "target": "algae_biomass",
        "tier": "F1",
        "dt_ms": 60000,
        "f1": {
          "form": "first_order_lag",
          "time_constant_s": 172800,
          "gain": 1.0,
          "inputs": [
            "feed_load"
          ]
        }
      },
      {
        "target": "ammonia_true",
        "tier": "F1",
        "dt_ms": 60000,
        "f1": {
          "form": "first_order_lag",
          "time_constant_s": 43200,
          "gain": 0.2,
          "inputs": [
            "feed_load"
          ],
          "clamp": {
            "min": 0.0,
            "max": 8.0
          }
        }
      },
      {
        "target": "stock_mortality",
        "tier": "F1",
        "dt_ms": 60000,
        "f1": {
          "form": "threshold_integrator",
          "threshold": 2.0,
          "direction": "below",
          "gain": 0.00014,
          "inputs": [
            "dissolved_oxygen_true"
          ],
          "clamp": {
            "min": 0.0,
            "max": 1.0
          }
        }
      }
    ],
    "channels": [
      {
        "name": "pond.dissolved_oxygen",
        "value_type": "number",
        "unit": "mg/L",
        "resolution": 0.01,
        "range": {
          "min": 0.0,
          "max": 14.0
        },
        "observes": "dissolved_oxygen_true",
        "observation_bias": {
          "state": "probe_fouling",
          "coef": 2.5,
          "noise_scale_at_full": 0.1
        },
        "description": "The probe. Fouling biases it high and collapses its variance — it reads plausible and stable while the pond suffocates, which is exactly what makes do_probe_fouling lethal.",
        "fidelity": "F1",
        "iso13374_role": "data_acquisition",
        "cadence": {
          "mode": "periodic",
          "period_s": 60,
          "jitter_s": 2
        },
        "noise": {
          "model": "gaussian",
          "sigma": 0.08
        },
        "drift": {
          "rate_per_hour": 0.0,
          "model": "linear"
        },
        "absence": "signal",
        "availability": {
          "uptime": 0.999,
          "mttr_s": 600
        },
        "link_delay": {
          "model": "exponential",
          "mean_s": 1.5,
          "max_s": 30
        }
      },
      {
        "name": "pond.water_temperature",
        "value_type": "number",
        "unit": "degC",
        "resolution": 0.1,
        "range": {
          "min": 15.0,
          "max": 40.0
        },
        "observes": "water_temp_true",
        "fidelity": "F1",
        "iso13374_role": "data_acquisition",
        "cadence": {
          "mode": "periodic",
          "period_s": 300,
          "jitter_s": 5
        },
        "noise": {
          "model": "gaussian",
          "sigma": 0.05
        },
        "absence": "signal",
        "link_delay": {
          "model": "exponential",
          "mean_s": 1.5,
          "max_s": 30
        }
      },
      {
        "name": "pond.ammonia",
        "value_type": "number",
        "unit": "mg/L",
        "resolution": 0.01,
        "range": {
          "min": 0.0,
          "max": 8.0
        },
        "observes": "ammonia_true",
        "fidelity": "F1",
        "iso13374_role": "data_acquisition",
        "cadence": {
          "mode": "periodic",
          "period_s": 900
        },
        "noise": {
          "model": "gaussian",
          "sigma": 0.03
        },
        "absence": "signal",
        "link_delay": {
          "model": "exponential",
          "mean_s": 1.5,
          "max_s": 30
        }
      },
      {
        "name": "pond.ph",
        "value_type": "number",
        "unit": "pH",
        "resolution": 0.01,
        "range": {
          "min": 5.0,
          "max": 10.0
        },
        "observes": "ph_true",
        "fidelity": "F1",
        "iso13374_role": "data_acquisition",
        "cadence": {
          "mode": "periodic",
          "period_s": 900
        },
        "noise": {
          "model": "gaussian",
          "sigma": 0.02
        },
        "absence": "signal",